Title,Price,URL
Beme Ripper Gaming Earphones,"Sale priceFrom Rs.1,499.00 PKR",https://saamaan.pk/products/beme-ripper-gaming-earphones-3
Lenovo HE05 Neckband Bluetooth,"Sale priceRs.1,499.00 PKR",https://saamaan.pk/products/lenovo-he05-neckband-bluetooth
AYRing Temperature Affect Color Changing Mood Ring,Sale priceRs.449.00 PKR,https://saamaan.pk/products/ayring-temperature-affect-color-changing-mood-ring
Multifunctional Zoom Flashlight With Currency Checker,N/A,https://saamaan.pk/products/multifunctional-zoom-flashlight-with-currency-checker
X8 Ultra Smartwatch 49MM with Bluetooth Calling,"Sale priceRs.7,999.00 PKR",https://saamaan.pk/products/x8-ultra-smartwatch-49mm-with-bluetooth-calling
Gionee Handsfree (Original),N/A,https://saamaan.pk/products/gionee-handsfree
"BEME Buds Pro 2 Ultimate with Built-in Display,ANC,ENC 8 in 1 Accessories","Sale priceRs.5,999.00 PKR",https://saamaan.pk/products/beme-buds-ultimate-with-built-in-display
Orafit Mega Smart Watch,N/A,https://saamaan.pk/products/orafit-mega-smart-watch
Air Max LCD Display Transparent Earbuds,"Sale priceRs.2,999.00 PKR",https://saamaan.pk/products/air-max-transparent-display-buds-with-enc
Transparent Wireless + Bluetooth Dual-Mode Rechargeable Mouse,"Sale priceRs.1,499.00 PKR",https://saamaan.pk/products/new-transparent-wireless-bluetooth-dual-mode-rechargeable-mouse
HiWatch Pro T900 Ultra 2 Smart Watch,"Sale priceRs.1,999.00 PKR",https://saamaan.pk/products/hiwatch-pro-t900-ultra-2-smart-watch
"Tiktok,Instagram Bluetooth Remote For Android Phones","Sale priceRs.1,499.00 PKR",https://saamaan.pk/products/wireless-controller-self-timer-selfie-stick
BEME Explorer PowerBank 2 Max 22.5W 20000mAh with iPhone 15 Supported Chip,"Sale priceFrom Rs.6,499.00 PKR",https://saamaan.pk/products/beme-explorer-powerbank-2-max-22-5w-20000mah
BEME Explorer PowerBank 2 22.5W 10000mAh with iPhone 15 Supported Chip,"Sale priceFrom Rs.4,499.00 PKR",https://saamaan.pk/products/beme-explorer-powerbank-2-22-5w-10000mah
Glow in the Dark Shoes Laces Pair,Sale priceRs.699.00 PKR,https://saamaan.pk/products/night-running-colorful-fluorescent-luminous-gift-belt-sports-canvas-small-white-sneakers-rope-luminous-flat-shoelaces
YOLO Fortuner Calling Smart Watch with 1 Year Warranty,"Sale priceRs.7,400.00 PKR",https://saamaan.pk/products/yolo-fortuner-calling-smart-watch-with-1-year-warranty
BEME Elite Buds Voice Changing Earbuds with ENC,"Sale priceRs.4,999.00 PKR",https://saamaan.pk/products/beme-elite-buds-voice-changing-earbuds-with-enc
"Sweatproof Gaming Gloves For PUBG, FREE FIRE, Call OF Duty and Bike Riding Usage",Sale priceRs.899.00 PKR,https://saamaan.pk/products/pubg-gloves
14 in 1 Stainless Steel Multi-Function Tool Card,N/A,https://saamaan.pk/products/14-in-1-stainless-steel-multi-function-saber-card
4 in 1 Folding Ballpoint Pen,Sale priceRs.479.00 PKR,https://saamaan.pk/products/4-in-1-folding-ballpoint-pen
BEME Explorer Transparent TWS Speaker,"Sale priceFrom Rs.3,999.00 PKR",https://saamaan.pk/products/beme-explorer-transparent-tws-speaker
"Mibro T1 Smart Watch with AMOLED Display, Bluetooth Calling (1 Month Warranty)","Sale priceRs.12,999.00 PKR",https://saamaan.pk/products/mibro-t1-smart-watch-with-amoled-display-bluetooth-calling-and-2atm-water-resistance
Ship Humidifier,Sale priceRs.699.00 PKR,https://saamaan.pk/products/ship-humidifier-donut
Car Glass Stain Remover Oleophobic Coating Gel,"Sale priceRs.1,199.00 PKR",https://saamaan.pk/products/car-glass-stain-remover-oil-film-removal-paste-windshield-remover-heavy-dirt-cleaning-paste
Colorful Unlimited Writing Eternal Pencil,Sale priceRs.599.00 PKR,https://saamaan.pk/products/colorful-unlimited-writing-eternal-pencil
RFID Blocking Minimalist Wallet for Men & Women,"Sale priceRs.1,499.00 PKR",https://saamaan.pk/products/rfid-blocking-minimalist-wallet-for-men-women
Mini Stainless Steel Folding Knife. Circle shaped with screw heads,"Sale priceRs.1,099.00 PKR",https://saamaan.pk/products/outdoor-mini-stainless-steel-folding-knife
Wire Cable Rotatable Storage Box and Mobile Phone Holder Portable Round,Sale priceRs.299.00 PKR,https://saamaan.pk/products/portable-round-rotatable-wire-cable-storage-box
Tire Pressure Gauge Keychain with Display Count,Sale priceRs.999.00 PKR,https://saamaan.pk/products/tire-pressure-gauge-keychain
Mini Car Turbo Keychain,N/A,https://saamaan.pk/products/car-turbo-keychain
BEME Photon Buds Solar Powered,"Sale priceFrom Rs.4,499.00 PKR",https://saamaan.pk/products/beme-photon-buds-solar-powered
"E-Writing-Pad / Tablet, 8.5 inch Electronic Drawing Pads for Kids, Portable Reusable Erasable",N/A,https://saamaan.pk/products/x
Aspor A351 2IN1 iPhone & Type-C Flexible Portable Mini 5000mAh Power Bank,"Sale priceRs.2,499.00 PKR",https://saamaan.pk/products/aspor-a351-2in1-iphone-type-c-flexible-portable-mini-5000mah-power-bank
Gyro Fidget Cube Sensory Infinity Cube Autism Relief Toys,Sale priceRs.410.00 PKR,https://saamaan.pk/products/gyro-cube
Italio Tech EarPods Type-C iPhone 15 & Android Supported Handsfree,"Sale priceRs.1,299.00 PKR",https://saamaan.pk/products/italio-tech-type-c-handsfree
BEME NeckWave Pro Voice Changing Neckband With Dual Batteries,"Sale priceFrom Rs.3,999.00 PKR",https://saamaan.pk/products/beme-neckwave-pro-voice-changing-neckband-with-dual-batteries
BEME Turtle Dual Functionality Wireless Speaker and Earbuds,"Sale priceFrom Rs.5,999.00 PKR",https://saamaan.pk/products/beme-turtle-dual-functionality-wireless-speaker-and-earbuds
Adjustable Universal Plastic Phone Holder for Smartphones and Tablets,Sale priceRs.199.00 PKR,https://saamaan.pk/products/adjustable-universal-plastic-phone-holder-for-smartphones-and-tablets
Waterproof Unisex Non-Slip Silicone Shoe Covers Reusable,Sale priceRs.549.00 PKR,https://saamaan.pk/products/waterproof-unisex-non-slip-silicone-reuseable-shoe-covers
Magnetic Finger Rings Fidget Spinner Toy Anti-Stress Anxiety Relief,Sale priceRs.699.00 PKR,https://saamaan.pk/products/camouflage-gear-magnetic-bracelet-ji-ring-decompression-toy-decompression-ring-finger-gyro
Pack of 4 Silicon Cable Buckles,Sale priceRs.190.00 PKR,https://saamaan.pk/products/pack-of-4-silicon-cable-buckle
Personal Information Privacy Identity Protection Roller Stamp Gadget,Sale priceRs.249.00 PKR,https://saamaan.pk/products/roller-garbled-code-security-stamp-express-bill-privacy-smear
Haino Teko C8 Calling SmartWatch 3 Straps Version.,"Sale priceRs.8,999.00 PKR",https://saamaan.pk/products/haino-teko-c8-smartwatch
BEME Buds Ultra,"Sale priceFrom Rs.5,999.00 PKR",https://saamaan.pk/products/beme-buds-ultra
LucaElbow Shirt Summer Design,N/A,https://saamaan.pk/products/lucaelbow-shirt-summer-design
Transparent ARC Electric Lighter USB Camping COB Light Rechargeable Waterproof,"Sale priceRs.2,599.00 PKR",https://saamaan.pk/products/usb-double-electric-arc-lighter-cob-light-3-lighitng-modes-flashlight-1
BEME Explorer Mini 2 22.5W 5000mAh PowerBank with iPhone 15 Supported Chip,"Sale priceFrom Rs.2,999.00 PKR",https://saamaan.pk/products/beme-explorer-mini-2-22-5w-5000mah-powerbank
4 in 1 Extension and Charger 180 degree with 2 USB ports,Sale priceRs.999.00 PKR,https://saamaan.pk/products/180-degree-extension-plug-adapter
Foldable Travel Backpack Outdoor Camping Hiking Fitness Cycling Mountaineering Bag,Sale priceRs.999.00 PKR,https://saamaan.pk/products/outdoor-folding-bag-new-travel-bag-waterproof-storage
Mini Small Flint/Fire Starter Rod Magnesium Rod Small and Portable,Sale priceRs.169.00 PKR,https://saamaan.pk/products/mini-small-flint-fire-rod-magnesium-rod-small-and-portable-20g
FT42 Ultra Smart Watch,N/A,https://saamaan.pk/products/ft42-ultra-smart-watch
Usb to Type C Metal OTG Keychain,Sale priceRs.189.00 PKR,https://saamaan.pk/products/usb-to-type-c-metal-otg-keychain
20-In-1 Stainless Steel Wrench Screwdriver Multi Tools Keychain,Sale priceRs.930.00 PKR,https://saamaan.pk/products/20-in-1-stainless-steel-wrench-screwdriver-multi-tools
Lenovo Thinkplus CyberPunk,"Sale priceFrom Rs.4,999.00 PKR",https://saamaan.pk/products/lenovo-thinkplus-livepods-xt81
Car Windshield Glass Washer Cleaner Tablets,N/A,https://saamaan.pk/products/car-windshield-glass-washer-cleaner-tablets-pack-of-6
Italio Tech Type-C to C 30W Fast Charging Cable,Sale priceRs.999.00 PKR,https://saamaan.pk/products/italio-tech-type-c-to-c-30w-fast-charging-cable
"Multi-Function Emergency Hammer Flashlight With Power Bank, Window Breaker, Seat Belt Cutter","Sale priceRs.2,149.00 PKR",https://saamaan.pk/products/emergency-hammer-light-torch
Nia Q6 Bluetooth Wireless Headphone,"Sale priceRs.3,199.00 PKR",https://saamaan.pk/products/nia-q6-bluetooth-wireless-headphone
Magic Flame Fire Color Changing Powder,Sale priceRs.299.00 PKR,https://saamaan.pk/products/spot-magic-fire-color-flame-powder-magic-flame
Multifunctional Tool Card and Phone Holder,Sale priceRs.399.00 PKR,https://saamaan.pk/products/multifunctional-card-and-phone-holder
SK22 2 in 1 Smart Watch With Bluetooth Calling,N/A,https://saamaan.pk/products/sk22
USB Aroma Diffuser,Sale priceRs.699.00 PKR,https://saamaan.pk/products/usb-aroma-diffuser
Fishing Glow Sticks Rod Tip Glow Sticks,Sale priceRs.499.00 PKR,https://saamaan.pk/products/thkfish-fishing-glow-sticks-rod-tip-glow-sticks
MicroFiber Towel Yellow And Grey Double Sided 40cm x 30cm,Sale priceRs.399.00 PKR,https://saamaan.pk/products/microfiber-towel-yellow-and-grey-double-sided-40cm-x-30cm
Magnetic Air Vent Car Mount Phone Holder,Sale priceRs.380.00 PKR,https://saamaan.pk/products/magnetic-air-vent-car-mount-phone-holder
12 in 1 Outdoor Keychain Screwdriver Bicycle Repair Tools Kits,Sale priceRs.450.00 PKR,https://saamaan.pk/products/12-in-1-outdoor-keychain-screwdriver-bicycle-repair-tools-kits-1
Electric Hand Warmer Self-Heating Cushion- MJ2050-HEJ,"Sale priceRs.1,299.00 PKR",https://saamaan.pk/products/murphy-selfheating-cushion-msh101
Mini staple less stapler,Sale priceRs.397.00 PKR,https://saamaan.pk/products/mini-stapler
Speed-X SPE27-2 Dual Lens Night Vision Motion Detection Bulb Camera,"Sale priceRs.4,499.00 PKR",https://saamaan.pk/products/speed-x-spe27-2-dual-lens-night-vision-motion-detection-bulb-camera
Bottle Opener Nail Clippers With Keychain,Sale priceRs.399.00 PKR,https://saamaan.pk/products/bottle-opener-nail-clippers
Cable Winder Cord Wrap Cord Organizer for Kitchen Appliances,Sale priceRs.149.00 PKR,https://saamaan.pk/products/the-cord-wrapper-kitchen-cord-wrapper-flexible-cord-storage-fixed-hider-cord-organizer
Measure Tape Keychain 1.5Meter,Sale priceRs.799.00 PKR,https://saamaan.pk/products/1-5m-5ft-tape-measure-keychain
Rose Crystal Diamond RGB Table Lamp,N/A,https://saamaan.pk/products/rose
Pack Of 4 Transparent Dust Cover,N/A,https://saamaan.pk/products/dust-plug-1
6 in 1 Multifunctional Mini Folding Key Knife Tool Keychain,Sale priceRs.359.00 PKR,https://saamaan.pk/products/multifunctional-key-knife-mini-folding-knife-lock-keychain-tool-knife-creative-6-in-1-folding-knife
"D8S Kids Digital Camera – 1080P HD, 48MP, Front & Rear Dual Lens, Thermal Print","Sale priceRs.6,699.00 PKR",https://saamaan.pk/products/d8s-childrens-time-front-back-rear-hd-digital-thermal-print-camera-is-a-fun-and-functional-camera-designed-for-kids
Bug Bite Remover Vacuum Venom Extractor,Sale priceRs.450.00 PKR,https://saamaan.pk/products/bebathing-vacuum-venom-extractor-mosquito-bee-bite-venom
Mini Portable Vacuum Cleaner Wireless Handheld,"Sale priceRs.1,499.00 PKR",https://saamaan.pk/products/handheld-desktop-vacuum-cleaner-student-portable-eraser-household-wireless-mini-vacuum-cleaner
Infinity Calling Smart Watch by Comet,"Sale priceRs.7,999.00 PKR",https://saamaan.pk/products/infinity-calling-smart-watch-by-comet
Rakco Electric Car Heating & Cooling Fan,"Sale priceRs.2,299.00 PKR",https://saamaan.pk/products/rackco-heater
Magnus Smart Watch by Comet,"Sale priceRs.6,999.00 PKR",https://saamaan.pk/products/magnus-smart-watch-by-comet
Disposable Scented Paper Soap Roll Portable,Sale priceRs.290.00 PKR,https://saamaan.pk/products/portable-disposable-scented-soap-roll
7 in 1 Outdoor Survival Whistle Keychain With Compass Magnifier LED light Thermometer,Sale priceRs.999.00 PKR,https://saamaan.pk/products/outdoor-camping-7-in-1-multi-function-safety-whistle
Magnet Wire Clamp P1,Sale priceRs.670.00 PKR,https://saamaan.pk/products/p1-magnet-wire-clamp
Finger Chopsticks Anti-dirty Hand Play Games Finger Lazy Assistant Clip,Sale priceRs.199.00 PKR,https://saamaan.pk/products/new-accessory-anti-dirty-hand-play-games-finger-chopsticks-clip-snacks-phone
Toothpaste Pump Dispenser Self Closing Silicone Toothpaste Cap,Sale priceRs.129.00 PKR,https://saamaan.pk/products/toothpaste-cap-childrens-self-sealing-toothpaste-cap-silicone-cleaning-dust-proof
Remco Ultrasonic Steriliser,"Sale priceRs.1,499.00 PKR",https://saamaan.pk/products/ruit-cleaner-machine-low-noise-ultrasonic-vegetable-fruit-cleaning-machine
NANO Liquid Glass Screen Protector Oleophobic Coating Film Universal for Smart Phone,N/A,https://saamaan.pk/products/small-card-liquid-nano-mobile-phone-film-nano-liquid-film-liquid-tempered
Dmax Phone Holder for Bathroom and Kitchen,Sale priceRs.690.00 PKR,https://saamaan.pk/products/bathroom-wall-mounted-mobile-phone-holder-box
2 in 1 Portable ToothBrush,Sale priceRs.850.00 PKR,https://saamaan.pk/products/2-in-1-portable-tooth-brush
BEME PowerStrip Fast Charging Power Extension With Type-C & Type-A Charging Ports,"Sale priceFrom Rs.2,999.00 PKR",https://saamaan.pk/products/beme-powerstrip
Pepper Spray with Keychain,"Sale priceRs.1,490.00 PKR",https://saamaan.pk/products/reusable-pepper-spray-with-keychain
Sponge Magic Laundry Ball Absorbs Hair Without Hurting Clothes Cleaning,Sale priceRs.269.00 PKR,https://saamaan.pk/products/sponge-magic-laundry-ball-absorbs-cat-hair-without-hurting-clothes-cleaning
"300pcs/roll Removable Food Storage Labels For Home, Kitchen, Restaurant",Sale priceRs.360.00 PKR,https://saamaan.pk/products/amazon-explosive-home-kitchen-food-freezer-labels-food-storage-date-stickers
Luckarm Wireless Doorbell,N/A,https://saamaan.pk/products/luckarm-wireless-doorbell
Havit Gaming Headset HV-H2198d 6 Months Warranty,"Sale priceRs.2,600.00 PKR",https://saamaan.pk/products/havit-blue-green-hv-h2198d
Intelligent Automatic Sensor Foam Soap Dispenser Smart Induction Foam Dispenser Auto Liquid Soap Dispenser Touchless Hand Washer,"Sale priceRs.2,999.00 PKR",https://saamaan.pk/products/intelligent-automatic-sensor-foam-soap-dispenser-smart-induction-foam-dispenser-auto-liquid-soap-dispenser-touchless-hand-washer
"Box Opener Cutter With Thermal Correction Fluid, Knife ,Sharp.",Sale priceRs.799.00 PKR,https://saamaan.pk/products/thermal-paper-correction-fluid-knife-parcel-box-opener-anti
Guardian Angel Self Protection,Sale priceRs.499.00 PKR,https://saamaan.pk/products/guardian-angel-self-protection
"Boya BY-M1DM Dual Lavalier Universal Microphone with a Single 1/8 Stereo Connector, 13ft Cable for Cameras and Smmartphones",N/A,https://saamaan.pk/products/boya-by-m1dm-dual-lavalier-universal-microphone-with-a-single-1-8-stereo-connector-13ft-cable-for-cameras-and-smmartphones
Mini Remote Control Car Watch Toys 2.4 GHz Wrist Racing Car Watch For Kids,N/A,https://saamaan.pk/products/remote-control-car-toy
Havit Wired Headphones H2238d 6 Months Warranty,"Sale priceRs.2,499.00 PKR",https://saamaan.pk/products/havit-wired-headphones-h2238d
3 in 1 Multifunctional Portable Car Emergency Escape Rescue Tool,Sale priceRs.799.00 PKR,https://saamaan.pk/products/3-in-1-portable-car-emergency-escape-rescue-tool-multifunctional
Stainless Steel Multi-Functional Table Spoon and Knife Outdoor Camping Folding,"Sale priceRs.2,499.00 PKR",https://saamaan.pk/products/hong-feng-new-stainless-steel-multi-functional-table-knife-outdoor-camping-folding
Urallife Portable 300ml Humidifier USB Charging Desktop Luminous Cup Aroma Diffuser Cool Mist Maker Air Humidifier Purifier,N/A,https://saamaan.pk/products/luminous-cup-humidifier
Blulory Magsafe Battery Pack Wireless Powerbank - 5000mAh,N/A,https://saamaan.pk/products/blulory-battery-pack-magsafe
Generic 18W Qualcomm 3.0 Quick Charger,N/A,https://saamaan.pk/products/generic-18w-quick-3-0-charger-copy
HK9 Pro Plus Smartwatch Dual Straps,N/A,https://saamaan.pk/products/hk9-pro-plus-smartwatch-dual-straps
Lenovo GM2 Pro Wireless Earbuds,"Sale priceRs.2,799.00 PKR",https://saamaan.pk/products/lenovo-gm2-pro-wireless-earbuds
LDNIO A321 3.1A DUAL USB PORTS FAST CHARGE + MICRO USB CABLE  MOBILE CHARGER,Sale priceRs.950.00 PKR,https://saamaan.pk/products/ldnio-a321-3-1a-dual-usb-ports-fast-charge-micro-usb-cable-mobile-charger
DOBE Mobile Clamp For PS5 Controller TP5-0527B,N/A,https://saamaan.pk/products/dobe-mobile-holder-for-ps5-controller
Multi-Function Self Defense Tactical Pen With Emergency Led Light Whistle Glass Breaker Outdoor Survival,"Sale priceRs.3,499.00 PKR",https://saamaan.pk/products/tactical-pen-multi-function-defense-pen-with-led-light-broken-window-device
Space ChargeSync Type-C To Type-C Cable CE-470,N/A,https://saamaan.pk/products/space-ce-470-chargesync-type-c-to-type-c-cable
Aspor A350 50000mAh PowerBank 22.5w Fast Charging with LED,"Sale priceRs.8,599.00 PKR",https://saamaan.pk/products/aspor-a350-powerbank-50000mah-capacity-22-5w-fast-charging-with-led
Mini Slot Machine Keychain with Lucky Charm,N/A,https://saamaan.pk/products/creative-mini-spin-fruit-machine-slot-machine-lottery-machine-novel-palm-game-keychain-simulation-model-toy
Clothing Hair Removal Brush Double-sided Dust Removal Brush,Sale priceRs.490.00 PKR,https://saamaan.pk/products/clothing-hair-removal-brush-wholesale-double-sided-dust-removal-brush
Gionee C-Type Handsfree,Sale priceRs.799.00 PKR,https://saamaan.pk/products/gionee-c-type-handsfree
Havit Bluetooth Earphones E500BT 3 Months Warranty,"Sale priceRs.2,950.00 PKR",https://saamaan.pk/products/havit-bluetooth-earphones-e500bt
A9 Airpods Pro ANC/ENC Touch Screen Wireless Earbuds,"Sale priceRs.3,499.00 PKR",https://saamaan.pk/products/a9-airpods-pro-anc-enc-touch-screen-wireless-earbuds
HUAWEI Band 9,N/A,https://saamaan.pk/products/huawei-band-9
Audionic S-80 Type C 2.1 Dual USB Port Charger,Sale priceRs.699.00 PKR,https://saamaan.pk/products/audionic-s-80-type-c-2-1-dual-usb-port-charger
D10 MULTIMEDIA SPEAKER - USB 2.0,Sale priceRs.999.00 PKR,https://saamaan.pk/products/d10-multimedia-speaker-usb-2-0
Joyroom JR-CP1 Car Charger with Bluetooth Earphone Touch Sensor On Earbud v5.0,"Sale priceRs.2,599.00 PKR",https://saamaan.pk/products/joyroom-jr-cp1-car-charger-with-bluetooth-earphone-touch-sensor-on-earbud-v5-0
Space Charge-Sync Rope Lightning Cable CE-481,N/A,https://saamaan.pk/products/space-charge-sync-rope-2m-lightning-cable
Ronin Smart Watch R-07,"Sale priceRs.9,995.00 PKR",https://saamaan.pk/products/ronin-smart-watch-r-07
Haino Teko T92 Ultra Max with 2 Straps,"Sale priceRs.8,799.00 PKR",https://saamaan.pk/products/haino-teko-t92-ultra-max
Blulory Glifo 8 Ultra Smartwatch,"Sale priceRs.7,599.00 PKR",https://saamaan.pk/products/blulory-glifo-8-ultra-smartwatch
Havit Wired Headphones HV-H2178d 6 Months Warranty,"Sale priceRs.1,749.00 PKR",https://saamaan.pk/products/havit-wired-headphones-hv-h2178d
Havit RGB Speakers SK563  6 Months Warranty,"Sale priceRs.2,100.00 PKR",https://saamaan.pk/products/havit-rgb-speakers-sk563
Haino Teko RW-15 Smartwatch – Ceramic Gold,"Sale priceRs.8,599.00 PKR",https://saamaan.pk/products/haino-teko-rw-15-smartwatch-ceramic-gold
Space Speed Power bank 10000MaH SP-073,"Sale priceRs.3,899.00 PKR",https://saamaan.pk/products/space-speed-power-bank-10000mah-sp-073
Food Storage Vacuum Sealing Suction Bag With Mini Manual Vacuum Pump,"Sale priceRs.1,499.00 PKR",https://saamaan.pk/products/food-vacuum-vacuum-sealing-suction-bag-cooked-food-packaging-bag
Havit Microphone MC361 6 Months Warranty,"Sale priceRs.1,200.00 PKR",https://saamaan.pk/products/havit-microphone-mc361
Havit Gaming Mouse MS1022 6 Months Warranty,"Sale priceRs.2,550.00 PKR",https://saamaan.pk/products/havit-gaming-mouse-ms1022
Ronin R-06 Smart Watch,"Sale priceRs.7,995.00 PKR",https://saamaan.pk/products/ronin-r-06-smart-watch
Gravity Sensor Gesture Control Stunt Racing Car,N/A,https://saamaan.pk/products/gravity-sensor-gesture-control-stunt-racing-car
Baseus Tungsten Gold USB to iP 2.4A Fast Charging Data Cable,N/A,https://saamaan.pk/products/baseus-tungsten-gold-fast-charging-data-cable-usb-to-ip-2-4a-2m-black
TW8 Ultra Smart Watch,"Sale priceRs.7,799.00 PKR",https://saamaan.pk/products/tw8-ultra-smart-watch
BEME Transformer 65W Fast Charging Cable 5 in 1,"Sale priceRs.1,299.00 PKR",https://saamaan.pk/products/beme-transformer-65w-fast-charging-cable-5-in-1
Bluedio BT5 Wireless Headphone and Wired with Built-in Microphone,"Sale priceRs.4,499.00 PKR",https://saamaan.pk/products/bluedio-bt5-wireless-headphone-and-wired-with-built-in-microphone
Steam Deck 64 GB,N/A,https://saamaan.pk/products/steam-deck-64-gb
Havit RGB Speakers SK208 6 Months Warranty,"Sale priceRs.2,849.00 PKR",https://saamaan.pk/products/havit-rgb-speakers-sk208
TW-18 Ultra Smart Watch,"Sale priceRs.8,200.00 PKR",https://saamaan.pk/products/tw-18-ultra-smart-watch
Kieslect Smart Tag Lite,"Sale priceRs.6,449.00 PKR",https://saamaan.pk/products/kieslect-smart-tag-lite
Multi functional support universal Clipper /Holder,Sale priceRs.899.00 PKR,https://saamaan.pk/products/multicam-anchor-live-video-mobile-phone-clip-multi-functional-support-universal
Infrared Ray Tracking Wall Climbing Car With Laser Gun,N/A,https://saamaan.pk/products/tracking-wall-climbing-car
Havit RGB Speakers SK210Mini 6 Months Warranty,"Sale priceRs.1,799.00 PKR",https://saamaan.pk/products/havit-rgb-speakers-sk210mini
Baseus A2 Cordless Car Vacuum Cleaner 5000pa,"Sale priceRs.11,999.00 PKR",https://saamaan.pk/products/baseus-a2-cordless-car-vacuum-cleaner-5000pa
Havit Gaming Mouse MS1026 6 Months Warranty,N/A,https://saamaan.pk/products/havit-gaming-mouse-ms1026
Baseus Tungsten Gold Type-C to Type-C 100W Fast Charging Data Cable,N/A,https://saamaan.pk/products/baseus-tungsten-gold-fast-charging-data-cable-type-c-to-type-c-100w
Baseus Explorer Series Auto Power-Off Type-C to IP 20W Fast Charging Data Cable,"Sale priceRs.3,199.00 PKR",https://saamaan.pk/products/baseus-explorer-series-auto-power-off-fast-charging-data-cable-type-c-to-ip-20w-1m-black
Havit RGB Speakers SK206 6 Months Warranty,"Sale priceRs.1,999.00 PKR",https://saamaan.pk/products/havit-rgb-speakers-sk206
Z59 Ultra Smart Watch,"Sale priceRs.7,499.00 PKR",https://saamaan.pk/products/z59-ultra-smart-watch
HK10 Pro Max Smartwatch 2.02 Inches Large Screen 3D Visual Action,"Sale priceRs.8,500.00 PKR",https://saamaan.pk/products/hk10-pro-max-smartwatch-2-02-inches-large-screen-3d-visual-action
JOYROOM 3.5A Lightning+Type-C+Micro 3-in-1 Data Cable,"Sale priceRs.1,599.00 PKR",https://saamaan.pk/products/joyroom-s-1t3018a18-3-5a-lightning-type-c-micro-3-in-1-data-cable-1-2m-black
M90 Pro Earbuds LED Display Headset,"Sale priceRs.2,099.00 PKR",https://saamaan.pk/products/m90-pro-earbuds-led-display-headset
Baseus 10.5W Compact Mobile Charger Dual USB With CN PIN,"Sale priceRs.1,999.00 PKR",https://saamaan.pk/products/baseus-compact-charger-2u-10-5w-cn
Havit RGB Speakers SK204 6 Months Warranty,"Sale priceRs.2,999.00 PKR",https://saamaan.pk/products/havit-rgb-speakers-sk204
Havit Gaming Mouse MS1019 6 Months Warranty,"Sale priceRs.2,850.00 PKR",https://saamaan.pk/products/havit-gaming-mouse-ms1019
Audionic Royal 7,"Sale priceRs.8,799.00 PKR",https://saamaan.pk/products/audionic-royal-7
Xtrike-Me RGB Gaming Headset with Noise Reduction Microphone GH-712,"Sale priceRs.3,750.00 PKR",https://saamaan.pk/products/xtrike-me-rgb-gaming-headset-with-noise-reduction-microphone-gh-712
HUAWEI Watch FIT 3,N/A,https://saamaan.pk/products/huawei-watch-fit-3
Ronin Energy Saving Smart Micro USB Charger R-788,Sale priceRs.599.00 PKR,https://saamaan.pk/products/ronin-energy-saving-smart-charger-r-788
Mini Wood Grain Usb Humidifier,"Sale priceRs.2,399.00 PKR",https://saamaan.pk/products/mini-wood-grain-usb-humidifier
Baseus Superior Series Type-C to Type-C 100W Fast Charging Data Cable,N/A,https://saamaan.pk/products/baseus-superior-series-fast-charging-data-cable-type-c-to-type-c-100w
Havit RGB Speakers  SK201 6 Months Warranty,"Sale priceRs.4,400.00 PKR",https://saamaan.pk/products/havit-rgb-speakers-sk201
Baseus Tungsten Gold Type-C to Type-C 240W Fast Charging Data Cable,N/A,https://saamaan.pk/products/baseus-tungsten-gold-fast-charging-data-cable-type-c-to-type-c-240w-2m-black
Baseus Crystal Shine Series 100W Type-C to Type-C Fast Charging Data Cable,N/A,https://saamaan.pk/products/baseus-crystal-shine-series-fast-charging-data-cable-type-c-to-type-c-100w-1-2m
Xiaomi Mi Band 7 Pro,"Sale priceRs.21,499.00 PKR",https://saamaan.pk/products/xiaomi-mi-band-7-pro
Havit Wireless Charger W3001,"Sale priceRs.3,599.00 PKR",https://saamaan.pk/products/havit-wireless-charger-w3001
Slim Classic – She is Sexy Purple NUE 35ml Vaporized Perfume,N/A,https://saamaan.pk/products/slim-classic-she-is-sexy-purple-nue-35ml-vaporized-perfume
Lenovo He05x 2 Bluetooth 5.0 Earphones Hifi Magnetic Neckband Headset,"Sale priceRs.1,999.00 PKR",https://saamaan.pk/products/lenovo-he05x-2-bluetooth-5-0-earphones-hifi-magnetic-neckband-headset
ONIKUMA K19 Professional Gaming Headphone with RGB LED Backlight,"Sale priceRs.3,899.00 PKR",https://saamaan.pk/products/onikuma-k19-rgb-wired-stereo
Aspor A381 5000mAh 15W Magnetic Wireless Powerbank,"Sale priceRs.4,199.00 PKR",https://saamaan.pk/products/aspor-a381-magnetic-portable-mini-5000-mah-wireless-powerbank-15w
Aspor A336 Powerbank 20000mAh 22.5W Fast Charging,"Sale priceRs.4,499.00 PKR",https://saamaan.pk/products/aspor-a336-powerbank-20000mah-22-5w-high-capacity-with-led-display-fast-charging
Baseus Bowie M2s True Wireless Earbuds,"Sale priceRs.17,999.00 PKR",https://saamaan.pk/products/baseus-bowie-m2s-true-wireless-earphones-moon-white
